"ID";"Wave";"SiteCode";"Categories";"Feedback"
"1013301";"Wave 2 2024";"2224";"Service, People";"Retail Assistant pria yang berada di lantai atas tidak mau turun ke bawah untuk menjelaskan produk jam tangan ketika diminta, meskipun produk tersebut berada di lantai bawah. Selain itu, pengetahuan produk Retail Assistant wanita perlu ditingkatkan lebih lanjut, and tidak seharusnya dijadikan alasan bahwa mereka masih baru."
"1013776";"Wave 2 2024";"2339";"Service, Facility";"Saat di menit-menit akhir Pelanggan melakukan kunjungan, Retail Assistant sedikit kurang fokus dalam melayani Pelanggan karena sekaligus menyiapkan pesanan online atau hal lain yang tidak bisa dipastikan oleh Pelanggan. Kemudian beberapa bagian dinding area depan Store terlihat retak and mengelupas."
"1014465";"Wave 2 2024";"2172";"Facility, Service";"Secara keseluruhan kenyamanan store sudah baik tetapi store ini masih menggunakan toilet jongkok bukan toilet duduk, and untuk pelayanan Retail Assistant masih terbilang kurang."
"1013766";"Wave 2 2024";"2212";"Service";"Retail Assistant melayani Pelanggan with ramah and antusias, serta sangat membantu mencarikan / mengecek stok produk di Store lain. Namun memang masih sangat pasif untuk menyampaikan product knowledge mengenai keunggulan produk, cara perawatan produk, dll. Semoga kedepannya bisa lebih baik lagi."
"1013719";"Wave 2 2024";"2099";"Service";"Terdapat 1 Retail Assistant and 1 Trainee di Store, Retail Assistant bertugas sebagai Kasir sehingga selama pelayanan Pelanggan dilayani oleh Trainee. Selain itu, kondisi store sedang ramai pengunjung sehingga pelayanan yang diberikan oleh Traineepun kurang maksimal karena sekaligus melayani Pelanggan lain."
"1013440";"Wave 2 2024";"2332";"Cleanliness, Service, Transaction Process";"- Secara keseluruhan toko terlihat lumayan berantakan, dari lantai 1 sampai lantai 2 (tidak tertata with rapi). -Retail Assistant terlihat pasif, terdapat beberapa Pelanggan yang bisa berpotensi belanja lebih banyak jika Retail Assistant aktif and bisa melakukan upselling with baik. - Untuk servicenya sopan and welcoming namun tidak terlihat excited. - Kasir yang melayani staf wanita, tetapi nama yang tertera di struk adalah staf pria bernama Dandika Sahbana Putra."
"1013401";"Wave 2 2024";"5042";"Transaction Process";"Nama yang tertera pada struk belanja tidak sesuai with nama kasir yang melayani karena saat itu kasir yang melayani laki-laki namun pada struk tertulis a.n. Rina. Pelanggan melakukan kunjungan ulang untuk menanyakan warna jam tangan lain."
"1013398";"Wave 2 2024";"7041";"People, Service";"Secara keseluruhan kondisi toko bersih, rapi and nyaman. Product knowledge dari Retail Assistant yang melayani Pelanggan juga cukup bagus. Namun saat itu Retail Assistant tidak menyambut Pelanggan with baik. Kasir memakai topi and jaket sehingga mengurangi point penilaian. Mungkin kedepannya lebih diperhatikan lagi SOP penyambutan & penampilan Staff yang berlaku."
"1013496";"Wave 2 2024";"2030";"Service, People";"Selama kunjungan Pelanggan, Retail Assistant kurang begitu menggali kebutuhan Pelanggan and terdapat Staf yang tidak memakai lanyard and ID Card yang bisa Pelanggan lihat."
"1013568";"Wave 2 2024";"Closed";"Transaction Process, Cleanliness";"Pelanggan mengantri sekitar 6 menit untuk melakukan pembayaran, karena Kasir yang bertugas hanya 1. Outlet berdebu membuat pelanggan bersin-bersin."
"1013758";"Wave 2 2024";"2022";"Service";"Terdapat 2 Retail Assistant and 1 Trainee yang bertugas di Store, and kondisi Store saat Pelanggan melakukan kunjungan sedang ramai. Sehingga menurut Pelanggan pelayanan yang diberikan oleh Retail Assistant kurang maksimal, karena 1 Retail Assistant sibuk melayani Pelanggan lain and bolak-balik cek stok barang ke gudang, 1 Retail Assistant sibuk melayani pembayaran yang tidak ada hentinya selama Pelanggan di Store, sedangkan 1 Trainee bertugas melayani Pelanggan di lantai 2."
"1013644";"Wave 2 2024";"5064";"Service";"Saat Pelanggan berada di Store, produk khusus wanita sangat terbatas, hanya ada satu lemari gantung with stok display, and koleksi sling bag wanita Eiger sedikit. Retail Assistant terlalu sibuk with pekerjaan, sehingga banyak Pelanggan tidak dilayani. Ketika Pelanggan bertanya, Retail Assistant menjawab terburu-buru and singkat, lalu meninggalkan Pelanggan. Pelanggan merasa tidak suka karena Retail Assistant mengabaikan mereka, hanya melayani jika didekati and ditanya."
"1014353";"Wave 2 2024";"2190";"Service, Facility";"Saat Pelanggan melakukan kunjungan, kondisi Store sedang dalam kondisi ramai pengunjung sedangkan Staf yang bertugas hanya ada 2 Retail Assistant. Sehingga pelayanan yang diberikan kurang maksimal, karena perhatian Retail Assistant terbagi-bagi with Pelanggan lain. Kemudian terdapat tanaman hidup di dekat pintu fitting room."
"1015886";"Wave 2 2024";"2003";"Service";"Retail Assistant yang melayani sudah cukup aktif dalam memberikan informasi terkait ketersediaan produk namun bisa ditingkatkan kembali dalam menjelaskan terkait keunggulan and perawatan produk."
"1015257";"Wave 2 2024";"2269";"Cleanliness, Service";"Store Eiger Kalimalang dalam keadaan rapi, namun pada bagian toilet terkesan kotor and tidak terawat. Retail Assistant and Kasir melayani with baik, namun belum aktif untuk memberikan penjelasan mengenai keunggulan produk, cara perawatan produk, and lain-lain. Semoga kedepannya dapat ditingkatkan lagi pelayanannya."
"1015487";"Wave 2 2024";"Closed";"Service";"Tidak ada hal-hal lain yang dirasakan / ditemui Pelanggan pada saat berbelanja di toko Eiger. Namun mungkin untuk pelayanan Retail Assistant dalam memberikan penjeasan secara spontan dapat ditingkatkan kembali."
"1013586";"Wave 2 2024";"2018";"Cleanliness, Service, People";"Secara keseluruhan display masih terlihat berantakan di beberapa area. Area wall climbing di lantai 2 terlihat banyak sampah, kardus kosong, and barang yang tidak sesuai pada tempatnya, debu yg sangat tebal and tampak kotor, terlihat tidak terawat padahal terdapat petugas kebersihan. Selain itu zoning Retail Assistant terlihat kurang menyebar, karna itu tampak separuh area tidak terlihat adanya Retail Assistant yang standby. Retail Assistant terkesan pasif karena hanya membantu saat Pelanggan bertanya saja and tidak menawarkan produk atau menjelaskan keunggulan dari produk."
"1013812";"Wave 2 2024";"2284";"Service";"Perlu penambahan Staff atau Retail Assistant karena ketika toko sedang ramai pengunjung. Retail Assistant yang ada terlihat cukup kerepotan dalam melayani Pelanggan, sehingga hal ini berdampak atas peforma Retail Assistant, yang mana ketika Pelanggan melakukan kunjungan Retail Assistant yang melayani terasa kurang maksimal dalam melayani atas keterbatasan tersebut."
"1013656";"Wave 2 2024";"2039";"Service";"Pelayanan sudah and store sudah cukup baik"
"1013672";"Wave 2 2024";"2120";"Service";"Retail Assistant terkesan sibuk karena tidak ada Retail Assistant lain yang membantu hanya ada 1 Trainee yang membantu proses pengambilan barang saja. Pelanggan dalam jumlah banyak terkesan kurang maksimal."
"1013667";"Wave 2 2024";"2261";"Service";"Pelayanan staff Eiger cenderung pasif and tidak informatif, sehingga Pelanggan terlihat kebingungan."
"1013471";"Wave 2 2024";"5163";"Facility, Service";"Untuk ukuran toko lumayan kecil and tidak terdapat display tenda, serta untuk salam perpisahan ketika Pelanggan ingin meninggalkan store dilakukan oleh rekan Retail Assistant bukan with Retail Assistant yang melayani Pelanggan."
"1013705";"Wave 2 2024";"2246";"Transaction Process";"Nama kasir yang terdapat di struk belanja tidak sama with kasir yang melayani Pelanggan, Kasir yang melayani Pelanggan perempuan sedangkan nama di struk tertulis laki-laki."
"1013713";"Wave 2 2024";"7031";"Service";"Retail Assistant perempuan kurang informatif dalam menjelaskan produk tas and ketentuan paper bag, and baru menjelaskan setelah Pelanggan bertanya terlebih dahulu."
"1013668";"Wave 2 2024";"2316";"Service";"Pelayanan yang diberikan sudah baik and memuaskan. Retail Assistant sangat informatif."
"1013777";"Wave 2 2024";"2207";"Service, Cleanliness";"Pelayanan yang diberikan sudah cukup bagus, namun petugas menawarkan opsi kantong plastik sebagai kantong belanja. Untuk store masih terbilang bersih and rapi."
"1014690";"Wave 2 2024";"2007";"Service";"Retail Assistant melayani Pelanggan with baik, namun masih terkesan pasif. Retail Assistant tidak ada inisiatif untuk menjelaskan mengenai product knowledge, and terkesan hanya menjawab pertanyaan-pertanyaan yang diajukan oleh Pelanggan."
"1015755";"Wave 2 2024";"7036";"Service, Cleanliness, People";"Saat Pelanggan berkunjung di toko hanya ada 1 orang Retail Assistant and 1 Pelanggan. Retail Assistant tidak menyambut kedatangan Pelanggan, tetapi sibuk di meja Kasir. Retail Assistant tidak mendampingi Pelanggan selama Pelanggan melihat-lihat produk baik di lantai 1 maupun lantai 2. Retail Assistant kurang komunikatif, jadi kurang memberikan informasi-informasi terkait produk. Saat itu toilet sedang tidak dapat digunakan dikarenakan air sedang mati, Retail Assistant menyarankan untuk ke toilet sebelah yaitu toko Bodypack. Terdapat tempat sampah yang penuh di dekat meja kasir. Kunjungan kedua Pelanggan direkomendasikan jam tangan best seller tipe Sterk and Antero oleh Retail Assistant yang berbeda."
"1015892";"Wave 2 2024";"2346";"Service, Cleanliness";"Untuk pelayanan Retail Assistant baik Retail Assistant wanita di bagian jam tangan and Retail Assistant pria di bagian jam tangan best seller and produk tas cukup baik karena Retail Assistant selalu menghampiri ketika Pelanggan melihat-melihat produk berbeda, sementara untuk toilet store yang sedikit kotor."
"1014413";"Wave 2 2024";"7026";"Service";"Terdapat beberapa barang yang kosong and warnanya kurang lengkap. Pelayanan yang diberikan pasif tidak menjelaskan keunggulan produk, perawatan produk, dll."
"1016018";"Wave 2 2024";"2045";"Service, People, Transaction Process";"Retail Assistant dalam menyambut and melayani Pelanggan sudah cukup baik. Namun di beberapa bagian saat Pelanggan melihat-lihat produk and melakukan pembayaran, terdengar Retail Assistant mengobrol with Trainee yang lain. Saat ditanya terkait promo, Retail Assistant terlihat kurang hafal with promo yang sedang berjalan. Selain itu saat melakukan transaksi pembayaran Retail Assistant atau Kasir terkesan jutek with Pelanggan."
"1016847";"Wave 2 2024";"Closed";"Service";"Saat melakukan kunjungan store terlihat dalam keadaan bersih and nyaman. Pelayanan yang diberikan oleh Retail Assistant cukup inisiatif memberikan informasi terkait produk jam tangan yang best seller."
"1013842";"Wave 2 2024";"5025";"Service";"Retail Assistant melayani Pelanggan with ramah and bersikap membantu untuk mencarikan stok produk di Store lain, namun memang masih belum ada inisiatif untuk menjelaskan mengenai product knowledge seperti garansi produk, keunggulan produk, cara perawatan produk, dll."
"1013838";"Wave 2 2024";"2210";"Service";"Kebanyakan Retail Assistant maupun Trainee di store kurang inisiatif dalam membantu Pelanggan, Retail Assistant lebih sering melakukan penataan display daripada membantu Pelanggan. Retail Assistant harus dicari and harus dihampiri terlebih dahulu agar dapat membantu Pelanggan."
"1014039";"Wave 2 2024";"2049";"Service, People";"Pelanggan menemukan Staff yang tidak diketahui statusnya (Seragam tidak sesuai with Retail Assistant maupun Trainee). Bisa dikatakan Store Leader namun terlihat kurang ramah and pasif dalam melayani Pelanggan, sedangkan kondisi Store sedang ramai pengunjung sehingga Retail Assistant yang lain terlihat kewalahan."
"1015506";"Wave 2 2024";"2233";"Service";"Saat Pelanggan melakukan kunjungan ke Store terdapat 2 Retail Assistant yang bertugas, 1 orang bertugas di lantai 1 and 1 orang bertugas di lantai 2. Saat kondisi ramai pengunjung, Retail Assistant yang berada di lantai 2 tidak terlihat turun ke lantai 1 untuk membantu melayani Pelanggan."
"1014218";"Wave 2 2024";"7002";"Service";"Yang melayani adalah Store Leader, karna yang bertugas di store hanya ada Store Leader and Trainee. Pelanggan melakukan kunjungan ulang untuk menanyakan produk jam tangan dilayani oleh Retail Assistant (Foto terlampir)."
"1014223";"Wave 2 2024";"5108";"Service, Facility, Cleanliness";"Saat Pelanggan datang, hanya terdapat satu Retail Assistant, sementara jumlah Pelanggan mencapai 11 orang. Akibatnya, Retail Assistant hanya berada di sekitar area Kasir. Selain itu, lantai di toko Eiger tampak retak and kotor."
"1013845";"Wave 2 2024";"7037";"Transaction Process, Facility, Cleanliness, Service";"Pelanggan mendapati perbedaan harga antara price tag with POS Kasir. ST EG MARTADINATA MANADO sudah terlihat baik, hanya saja terdapat beberapa temuan, seperti terdapat noda pada lemari display, terdapat sampah pada area parkir and toilet yang gabung with gudang. Selain itu perlu adanya tambahan Retail Assistant sehingga paling tidak ada yang mendampingi Pelanggan saat melihat-lihat produk and dapat memberikan penjelasan."
"1014009";"Wave 2 2024";"5056";"Service";"Saat Pelanggan melakukan kunjungan, kondisi Store sedang ramai pengunjung. Pelayanan yang diberikan oleh Retail Assistant kurang maksimal, tidak ada inisiatif menawarkan bantuan sehingga Pelanggan perlu memanggilnya terlebih dahulu jika membutuhkan bantuan. Kemudian saat Pengunjung mulai berkurang, Retail Assistant terlihat mengobrol with rekannya."
"1014004";"Wave 2 2024";"2279";"Service";"Retail Assistant melayani with baik, namun masih terkesan pasif. Ketika Pelanggan sedang melihat-lihat produk, Retail Assistant tidak ada inisiatif untuk menjelaskan mengenai product knowledge. Retail Assistant lebih ke hanya menjawab pertanyaan-pertanyaan jika Pelanggan bertanya."
"1015977";"Wave 2 2024";"2313";"Service";"Retail Assistant menjelaskan and memperagakan display produk with tulus and baik tapi cukup minim inisiatif, itu saja."
"1013826";"Wave 2 2024";"2218";"Service";"Terdapat 1 Retail Assistant and 1 Trainee yang bertugas di Store. Pelayanan Retail Assistant ramah and baik, namun kurang inisiatif untuk menjelaskan detail produk yang diminati oleh Pelanggan."
"1013848";"Wave 2 2024";"2004";"Service";"Pelayanan yang dilakukan oleh Retail Assistant sudah cukup baik. Retail Assistant sudah memberikan informasi terkait produk with detail. Hal yang mungkin dapat ditingkatkan kembali yaitu memberikan pengalaman kepada Pelanggan untuk dapat mencoba produk."
"1013858";"Wave 2 2024";"2065";"Cleanliness, People";"Ada daun yang layu/kering... Retail Assistant hanya 1 yang lainnya sepertinya training.. karna seragam hitam-hitam"
"1013958";"Wave 2 2024";"2079";"People";"Terdapat Retail Assistant lain yang tidak memakai ID Card."
"1013991";"Wave 2 2024";"7023";"Transaction Process";"Nama kasir di struk pembayaran tidak sesuai with kasir yang melayani Pelanggan."
"1014015";"Wave 2 2024";"2032";"Service";"Pelayanan yang diberikan kurang maksimal karena toko dalam keadaan ramai Pelanggan."
"1014026";"Wave 2 2024";"2135";"Cleanliness";"Outlet cukup ramai and staf yang melayani tetap ramah and komunikatif serta menggali kebutuhan Pelanggan. Namun toilet sangat perlu diperhatikan lagi karena tampilan and baunya yang tidak sedap memberikan kesan kurang baik apalagi terletak di samping fitting room lantai 2."
"1014070";"Wave 2 2024";"2188";"Service, Cleanliness";"Menurut Pelanggan untuk RA yang bertugas masih terkesan pasif and cuek dalam melakukan pelayanan. Pelanggan perlu memanggil terlebih dulu baru RA menghampiri. Selain itu untuk kondisi outlet juga cukup berantakan, cukup mengganggu kenyamanan pengalaman belanja Pelanggan."
"1014376";"Wave 2 2024";"2125";"Service";"Retail Assistant kurang responsif and kurang informatif pada saat melayani. Saat Retail Assistant terlihat sedang sibuk cek barang, sehingga tidak begitu fokus menghandle Pelanggan. Meski demikian, Retail Assistant cukup ramah and pelayanan cukup memuaskan. Semoga kedepannya dapat menentukan mana yang menjadi standar prioritas pada saat bertugas."
"1014111";"Wave 2 2024";"2393";"Service, Facility";"Pada saat Pelanggan memasuki store, Retail Assistant stand by pada area Kasir and hanya menghampiri ketika Pelanggan butuhkan saja. Retail Assistant kurang aktif dalam menjelaskan keunggulan produk yang diminati Pelanggan, kemudian area toilet tidak bisa digunakan karena air sedang mati / padam."
"1014062";"Wave 2 2024";"2236";"Service";"Berdasarkan kunjungan yang dilakukan oleh Pelanggan, Retail Assistant kurang informatif ketika melayani Pelanggan."
"1014094";"Wave 2 2024";"Closed";"Service";"Hanya terdapat 1 Retail Assistant yang berada di store sewaktu Pelanggan tiba pukul 19.00. Sekitar pukul 19.32 saat Pelanggan hendak menuju toilet, baru terdapat seorang Retail Assistant yang menemani."
"1014122";"Wave 2 2024";"7033";"Service";"Pelayanan yang diberikan kurang maksimal karena Retail Assistant hanya 2 orang and sibuk melayani Pelanggan lain. Terjadi pergantian pelayanan saat di kasir dari Retail Assistant wanita ke Retail Assistant pria. Pelanggan melakukan kunjungan ulang untuk menanyakan warna jam tangan yang direkomendasikan Retail Assistant (Foto terlampir)."
"1014298";"Wave 2 2024";"2053";"Service, People";"Saat Pelanggan memasuki area toko, Reail Assistant wanita sedang melayani Pelanggan lain di meja kasir. Pelanggan tidak melihat display jam tangan di lantai 1, sehingga Pelanggan bertanya ke Retail Assistant wanita tentang display jam tangan dimana, lalu diarahkan ke lantai 2. Di lantai 2 terlihat sepi hanya ada 1 orang Trainee yang stanby. Trainee menghampiri Pelanggan untuk menanyakan kebutuhan Pelanggan, lalu Pelanggan hanya bilang mau lihat-lihat dulu sehingga Trainee memberikan pilihan produk jam tangan terbaru and meninggalkan Pelanggan. Pelanggan mencoba membawa 1 jam tangan ke meja kasir untuk menanyakan warna lain serta harga dari jam tersebut with harapan nantinya ada Retail Assistant yang mendampingi Pelanggan saat memilih jam tangan, namun Kasir hanya merespon pertanyaan Pelanggan saja. Sehingga Pelanggan kembali ke lantai 2 and menanyakan rekomendasi jam best seller ke Trainee. Saat Pelanggan sedang memilih-milih tas, terlihat ada Retail Assistant pria yang tidak memakai seragam lengkap. Retail Assistant tersebut membantu Pelanggan mengambilkan stok baru dari tas yang diminati. Namun saat memberikan stok baru dari tas tersebut, Retail Assistant berbicara kepada Pelanggan with memalingkan wajahnya ke Kasir lalu lanjut ngobrol with Kasir."
"1014332";"Wave 2 2024";"2040";"Facility";"Tinta pada struk belanja terlihat pudar atau kurang tebal, sehingga struk sulit dibaca. Selain itu dinding di kamar mandi terlihat seperti ada bekas rembesan."
"1014305";"Wave 2 2024";"2013";"Service";"Pelayanan yang diberikan oleh Retail Assistant cukup baik and bisa membantu Pelanggan mencari produk yang diminati. Display produk juga terlihat tertata with baik."
"1015101";"Wave 2 2024";"Closed";"Facility";"Wallpaper pada area kasir terlihat sudah mengelupas. Pelanggan melakukan kunjungan ulang untuk bagian tanya jam tangan and juga greeting akhir."
"1014446";"Wave 2 2024";"2118";"Cleanliness";"Terdapat noda kerak pada lantai fitting room and toilet."
"1015943";"Wave 2 2024";"2159";"Service, Facility";"Saat Pelanggan melakukan kunjungan ke Store, Retail Assistant yang bertugas hanya ada 1 orang sedangkan Pelanggan yang ada cukup banyak. Sehingga Pelanggan perlu menunggu beberapa waktu untuk mendapatkan perhatian Retail Assistant and menanyakan mengenai product knowledge. Kemudian terdapat tumpukan banner yang disimpan di belakang area display produk."
"1014551";"Wave 2 2024";"5159";"Service, Cleanliness";"Pelayanan yang diberikan oleh Staf sangat baik and suasana store dalam keadaan bersih, wangi and tertata with baik."
"1014410";"Wave 2 2024";"2043";"Service";"Semua sudah tercover dalam checklist kuesioner."
"1014427";"Wave 2 2024";"Closed";"Service";"Pelanggan melakukan kunjungan ulang untuk menanyakan warna yang tersedia dari rekomendasi jam tangan, and dilayani oleh Retail Assistant (Foto terlampir)."
"1014474";"Wave 2 2024";"2231";"Service";"Semua sudah terdapat dalam kuesioner. Tidak ada hal-hal lain yang dirasakan/ ditemui pada saat kunjungan."
"1013451";"Wave 2 2024";"2085";"Service, People";"Saat pelanggan datang, Retail Assistant hanya berada di area kasir, and ada yang sedang mengangkat kardus, sehingga tidak banyak interaksi with Pelanggan. Terdapat Retail Assistant yang tidak menggunakan seragam sesuai standar ketentuan pada hari itu, hanya memakai kaos and sandal. Pelanggan melakukan kunjungan ulang untuk menanyakan jam tangan best seller and warna jam tangan."
"1014499";"Wave 2 2024";"5148";"Service";"Menurut Pelanggan, alangkah baiknya jika Retail Assistant yang sedang mengerjakan laporan di meja kasir lebih baik berhenti terlebih dahulu ketika ada Pelanggan yang masuk ke dalam Store. Pada saat pertama Pelanggan masuk hanya terdapat 1 Retai Assistant yang sedang bekerja di meja kasir & Staff training. Sedangkan terdapat 2 kelompok Pelanggan di dalam Store."
"1016469";"Wave 2 2024";"5017";"Service, Cleanliness, Facility";"Pelayanan yang diberikan oleh Retail Assistant sudah cukup baik. Ketika Pelanggan menanyakan terkait rekomendasi jam tangan untuk hadiah, Retail Assistant aktif menanyakan spesifikasi orang yang akan diberikan hadiah and juga memberikan banyak opsi pilihan jam tangan yang best seller. Namun jumlah Retail Assistant yang bertugas terhitung sedikit sehingga tidak ada Retail Assistant yang mendampingi Pelanggan saat melihat-lihat produk. Selain itu terdapat sampah di beberapa area Store and juga tumpukan kardus yang mengganggu jalur jalan Pelanggan."
"1014779";"Wave 2 2024";"2041";"Cleanliness";"Untuk suasana and keadaan store cukup baik and bersih, pelayanan yang dilakukan oleh Retail Assistant serta Kasir juga cukup baik. Hanya saja lantai di dalam toilet berwarna kuning and terlihat kusam."
"1015222";"Wave 2 2024";"2123";"Service";"Retail Assistant melayani Pelanggan with baik and ramah, aktif untuk menggali kebutuhan Pelanggan and merekomendasikan produk kepada Pelanggan. Saat itu, Retail Assistant yang bertugas hanya ada 1 Orang and tidak ada Pelanggan lain yang sedang berkunjung. Sehingga Retail Assistant dapat memberikan perhatian yang fokus kepada Pelanggan."
"1015069";"Wave 2 2024";"2130";"Service";"Retail Assistant melayani Pelanggan with baik and ramah. Saat Pelanggan melakukan kunjungan, kondisi store sedang cukup ramai pengunjung namun Retail Assistant melayani with sabar and tidak terburu-buru. Selain itu, Retail Assistant juga aktif menjelaskan mengenai produk kepada Pelanggan. Walaupun memang masih ada beberapa point yang terlewat, seperti mengenai garansi produk and penukaran barang."
"1015406";"Wave 2 2024";"2105";"Transaction Process, Facility";"Kasir yang melayani Pelanggan adalah seorang perempuan, namun nama yang tertera pada struk adalah nama pria. Selain itu, cat dinding pada tangga and wallpaper di area kasir terlihat sudah memudar and mengelupas."
"1014587";"Wave 2 2024";"Closed";"People";"Masukkan untuk pihak Eiger mencetak kembali ID Card pegawai and tulisan nama diperbesar, karena walaupun Pelanggan sudah menggunakan kacamata namun tulisannya kecil and susah terbaca."
"1014633";"Wave 2 2024";"2266";"Service";"Suasananya menyenangkan, Pelanggan bebas keliling melihat-lihat produk tanpa gangguan, Retail Assistant responsif membantu kebutuhan Pelanggan."
"1015426";"Wave 2 2024";"2019";"Service";"Store Eiger Depok dalam kondisi ramai, bersih, and kondusif. Pelayanan yang baik with Staf yang terbatas namun mampu menghandle Pengunjung yang ramai. Namun masih terdapat kekurangan seperti tidak menginformasikan keunggulan produk, perawatan produk, and lain-lain."
"1014689";"Wave 2 2024";"2129";"Service";"ST EG OL ISKANDAR PALEMBANG memiliki produk yang cukup lengkap. Pelayanan Retail Assistant sudah baik, hanya saja kurang aktif dalam menjelaskan keunggulan produk maupun menawarkan bantuan kepada Pelanggan."
"1014693";"Wave 2 2024";"2306";"Service, Cleanliness";"Retail Assistant terlihat pasif, hanya menjawab pertanyaan-pertanyaan yang diberikan oleh Pelanggan. Lantai masuk toilet agak kotor."
"1014681";"Wave 2 2024";"Closed";"Service";"Dari awal kedatangan Pelanggan ke store, Petugas kurang mendampingi Pelanggan untuk melihat atau memilih produk yang diinginkan, Petugas juga kurang inisiatif untuk memberikan saran kepada Pelanggan."
"1014708";"Wave 2 2024";"5045";"Cleanliness, Service";"Kebersihan store sudah baik, namun untuk pelayanan Retail Assistant perlu ditingkatkan. Pelanggan melakukan kunjungan ulang untuk menanyakan jam tangan."
"1014724";"Wave 2 2024";"7005";"Service";"Retail Assistant/Store Leader and Traine ramah and sangat membantu pelanggan. Pelanggan menanyakan produk jaket with menyampaikan ciri-ciri saja tanpa gambar, namun Retail Assistant sangat sigap and antusias mencarikan produk yang dimaksud."
"1014740";"Wave 2 2024";"7024";"Service, Facility";"Pelanggan merasa kurang puas with pelayanan dari Retail Assistant pertama karena terlihat kurang antusias, sementara Retail Assistant kedua menunjukkan sikap yang lebih antusias. Selain itu, terdapat salah satu poster yang ujungnya tidak lengkap atau rusak."
"1015076";"Wave 2 2024";"2304";"Service, Cleanliness";"Pelayanan yang diberikan Retail Assistant sudah sangat baik, suasana dalam outlet sangat nyaman and bersih."
"1015102";"Wave 2 2024";"2325";"Service";"Terdapat pegawai lain di lantai 2 namun tidak berinteraksi with pelanggan kecuali pelanggan yang bertanya terlebih dahulu. Pelanggan melakukan kunjungan ulang untuk bertanya terkait jam tangan kepada Retail Assistant (foto terlampir)."
"1014715";"Wave 2 2024";"2326";"People";"Terdapat 2 Retail Assistant yang bertugas. Salah satu Retail Assistant tidak memakai seragam sesuai panduan yaitu kurang pakai rompi coklat, sedangkan Retail Assistant yang satu lagi memakai seragam lengkap sesuai panduan (hari jumat)."
