"ID";"Wave";"SiteCode";"Categories";"Feedback"
"1032646";"Wave 3 2024";"2190";"Facility, Cleanliness";"Store Eiger Bintaro dalam kondisi baik dari segi penataan dan pelayanan. Namun, jalur menuju toilet perlu diperhatikan karena terdapat banyak barang yang berantakan di lantai dan kondisi toilet sedikit kotor."
"1032759";"Wave 3 2024";"2188";"Service";"Tidak ada, semua sudah tercakup di dalam kuesioner."
"1032814";"Wave 3 2024";"2204";"Service";"Pelayanan di store Pamulang cukup baik, terutama dengan kehadiran Retail Assistant yang melayani Pelanggan dengan ramah dan murah senyum saat mencoba T-Shirt."
"1032802";"Wave 3 2024";"5048";"Facility, Service";"Store Eiger di Palembang Square dalam kondisi baik and pelayanannya bagus, tetapi perlu diperhatikan soal kerapihan produk and ketersediaan price tag yang tidak ada di produk."
"1032736";"Wave 3 2024";"Closed";"Cleanliness, Service";"Store Eiger Antapani Bandung dalam kondisi baik, and pelayanan Retail Assistant cukup baik serta ramah. Namun, toilet perlu dibersihkan lebih sering karena terlihat sedikit kotor."
"1032828";"Wave 3 2024";"2197";"Service, People";"Terjadi penggantian Retail Assistant, yang pertama adalah Retail Assistant perempuan yang sama with kasir, kemudian berganti ke Store Leader laki-laki. Retail Assistant perempuan yang melayani pertama terkesan cuek, bahkan Pelanggan dibiarkan memilih sendiri produk di lantai 2 and kurang menggali kebutuhan Pelanggan. Sementara itu, Store Leader laki-laki yang menggantinya sudah bagus, karena menggali kebutuhan and menemani Pelanggan dalam memilih barang."
"1032735";"Wave 3 2024";"2343";"Service, People";"Storenya rapi, nyaman and bersih, tetapi pelayanan Retail Assistant kurang memuaskan, alangkah baiknya Kasir tidak melakukan video call saat melayani Pelanggan, demi menjaga kualitas pelayanan and perhatian penuh kepada Pelanggan."
"1032671";"Wave 3 2024";"2306";"Service";"Semua telah tercakup dalam kuesioner."
"1032766";"Wave 3 2024";"2352";"Service";"Pelanggan menyarankan agar Retail Assistant lebih aktif dalam menawarkan bantuan kepada Pelanggan. Mengajukan pertanyaan atau memberikan rekomendasi dapat membuat pengalaman belanja Pelanggan menjadi lebih menyenangkan."
"1032775";"Wave 3 2024";"2152";"Service";"Retail Assistant tampak pasif and kurang inisiatif, hanya memberikan penjelasan ketika diminta, tidak menjelaskan keunggulan produk secara jelas. Retail Assistant juga tidak menyambut atau mendekati Pelanggan yang baru datang, sehingga Pelanggan harus mendekatinya untuk mendapatkan informasi."
"1032778";"Wave 3 2024";"2272";"Service, Cleanliness, Facility";"Pelayanan yang diberikan Retail Assistant masih kurang baik, karena Retail Assistant tidak berinisiatif dalam menjelaskan produk secara detail. Selain itu keadaan Store juga masih kurang bersih di bagian toilet."
"1032786";"Wave 3 2024";"7026";"Service";"ST EG Kopo Bandung memiliki koleksi lengkap untuk keperluan hiking and aktivitas outdoor. Pelanggan juga sering berbelanja di Eiger karena kualitas produk yang baik serta harga yang terjangkau."
"1032860";"Wave 3 2024";"2334";"Facility";"Pelanggan menemukan berbagai masalah, seperti air tanaman yang merembes, engsel pintu yang tidak terawat, and hiasan yang tergeletak di bawah cermin."
"1032801";"Wave 3 2024";"2260";"Service, Cleanliness, Facility";"Store Eiger di Pahlawan Kediri cukup baik dari segi kenyamanan Pelanggan berbelanja, untuk Retail Assistant diharapkan untuk lebih aktif lagi dalam menjelaskan produk kepada Pelanggan. Selain itu toilet perlu dibersihkan secara rutin agar Pelanggan nyaman dalam menggunakannya."
"1032864";"Wave 3 2024";"5025";"Service";"Semua sudah tercakup dalam kuesioner."
"1032884";"Wave 3 2024";"2069";"Service";"Sudah terlampir semua dalam kuesioner."
"1032886";"Wave 3 2024";"2125";"Service, People";"Disarankan agar Retail Assistant lebih menunjukkan sikap proaktif and ramah dalam melayani pelanggan untuk menciptakan pengalaman yang lebih positif."
"1032890";"Wave 3 2024";"5105";"Service";"Store EIGER di Mall Lippo Plaza Jember sudah dalam kondisi yang cukup baik dari segi pelayanan. Meskipun saat itu store sedikit ramai and Retail Assistant juga sedang sibuk, mereka tetap membantu kebutuhan Pelanggan lain. Pelayanan yang diberikan cukup baik and ramah."
"1032685";"Wave 3 2024";"2317";"Service";"Saat Pelanggan menanyakan produk tas, datang Retail Assistant yang lain dari luar. Kemudian Retail Assistant yang dari luar memanggil Retail Assistant yang sedang melayani Pelanggan."
"1032850";"Wave 3 2024";"2310";"Service, People";"Retail Assistant sangat ramah dalam melayani Pelanggan dari awal masuk hingga keluar dari toko, Retail Assistant juga sabar dalam menjelaskan satu per satu produk yang tersedia. Baik Retail Assistant maupun Kasir menunjukkan sikap yang baik and sopan, tanpa terkesan terburu-buru dalam melayani Pelanggan. Kenyamanan and keramahan tersebut sesuai with standar operasional prosedur (SOP) yang ditetapkan oleh Eiger, and Retail Assistant menjalankan SOP tersebut with baik."
"1032901";"Wave 3 2024";"2008";"Service";"Semua sudah tercakup dalam kuesioner."
"1032868";"Wave 3 2024";"2246";"Facility, Service";"Store Eiger di Sawojajar, Malang, dalam kondisi baik, with pelayanan Retail Assistant yang memuaskan karena kondisi toko sedang sepi. Namun, area jalan menuju fitting room terhalang oleh banyak kardus, sehingga Pelanggan kesulitan untuk melewatinya."
"1032879";"Wave 3 2024";"5158";"Service, People";"Pelanggan merasa pelayanan terkesan ramah and sopan dalam menjelaskan tentang produk."
"1032724";"Wave 3 2024";"2032";"Facility, Cleanliness";"Sudah tercakup dalam kuesioner. Terdapat beberapa produk yang tidak memiliki price tag serta kondisi toilet tidak berbau tetapi lantai pada toilet memiliki kerak namun dapat dikatakan bersih."
"1032921";"Wave 3 2024";"2067";"Service, People";"Store Eiger di Salemba, Jakarta, dalam kondisi baik dari segi fasilitas, namun kurang optimal dalam aspek pelayanan. Retail Assistant tidak berada di lantai 2 saat Pelanggan membutuhkan bantuan, sehingga Pelanggan harus memanggil Retail Assistant di lantai 1 untuk mendapatkan pelayanan. Selain itu, Retail Assistant tidak mengenakan nametag and tampak kurang bersemangat dalam melayani Pelanggan."
"1032953";"Wave 3 2024";"2337";"Service";"Sudah tercakup dalam kuesioner."
"1032957";"Wave 3 2024";"2203";"Service";"Semua sudah tercakup dalam kuesioner."
"1032950";"Wave 3 2024";"2266";"Service";"Store Eiger Andi Djemma dalam kondisi cukup baik. Namun, sebagai saran, sebaiknya ID card and Lanyard diperbarui karena sudah buram sehingga sulit dibaca namanya."
"1032966";"Wave 3 2024";"5122";"Service, Cleanliness";"Secara keseluruhan, pelayanan Retail Assistant sudah baik, tetapi masih kurang dalam menjelaskan detail produk seperti garansi and penukaran produk. Selain itu Pelanggan menemukan tempat sampah yang sudah penuh di belakang meja kasir."
"1032968";"Wave 3 2024";"2304";"Cleanliness, Service";"Secara keseluruhan, display barang tampak rapi and pelayanan yang diberikan sangat ramah. Namun, saat Pelanggan akan memasuki outlet, terlihat tumpukan sampah di depan area outlet yang cukup mengganggu kesan rapi di area tersebut."
"1032980";"Wave 3 2024";"2305";"Cleanliness, Facility";"Disarankan agar toko lebih memperhatikan kebersihan ubin, dinding, and plafon toilet, serta memastikan kelengkapannya, seperti tisu toilet, untuk meningkatkan kenyamanan Pelanggan."
"1032992";"Wave 3 2024";"Closed";"Service";"Semua sudah tercakup dalam kuesioner."
"1032948";"Wave 3 2024";"2276";"Service";"Secara keseluruhan pelayanan Retail Assistant sudah ramah and tidak kaku, hanya perlu untuk lebih inisiatif lagi terutama dalam hal menjelaskan produk secara detail."
"1032940";"Wave 3 2024";"2229";"Service, Transaction Process";"Pelanggan menyarankan agar ditambahkan Petugas Kasir, karena Retail Assistant yang juga merangkap sebagai kasir membuat banyak pelanggan harus mendatangi kasir untuk bertanya."
"1032963";"Wave 3 2024";"Closed";"Service";"Pelanggan merasa cukup puas with pelayanan Retail Assistant."
"1032939";"Wave 3 2024";"Closed";"Service, Cleanliness, Facility";"Pelayanan di Store Eiger Talangbanjar Jambi sudah cukup baik with Retail Assistant and Kasir yang ramah. Namun, perlu diperhatikan kebersihan and kondisi di dalam toilet demi kenyamanan Pelanggan."
"1032889";"Wave 3 2024";"7030";"Service, Facility";"Store Eiger di Pamekasan Madura, sudah sangat baik dalam segi area store and pelayanan Retail Assistant, serta memberikan penjelasan yang baik mengenai produk yang dicari."
"1032959";"Wave 3 2024";"2244";"Service, People";"Retail Assistant tidak responsif dalam menghampiri Pelanggan, sehingga Pelanggan harus menghampiri Retail Assistant terlebih dahulu, Retail Assistant juga harusnya lebh aktif dalam mejelaskan detail Produkkepada Pelanggan. Selain itu saat kunjungan dilakukan, hampir semua Retail Assistant tidak memakai ID CARD."
"1033105";"Wave 3 2024";"5014";"Service, Facility";"Secara keseluruhan, pelayanan Retail Assistant sangat baik. Namun, mungkin perlu ada perbaikan pada fasilitas fitting room yang tersedia di outlet."
"1032663";"Wave 3 2024";"2261";"Service, People";"Pelanggan merasa bahwa Retail Assistant ramah and sangat santai, sehingga membuat Pelanggan merasa nyaman."
"1033062";"Wave 3 2024";"2387";"Facility";"Di beberapa spot, penataan rak pajangan terasa agak sempit. Sebaiknya ada penataan ulang with memberi ruang yang lebih luas agar Pelanggan dapat bergerak with lebih leluasa."
"1033070";"Wave 3 2024";"2083";"Service, People";"Store Eiger di Kendari dalam kondisi baik, namun Pelanggan mendapatkan pelayanan yang berbeda. Retail Assistant kurang proaktif dalam promosi and terkesan agak cuek, sementara Kasir sangat ramah and memberikan penjelasan yang sangat detail mengenai informasi produk."
"1033117";"Wave 3 2024";"2309";"Facility";"Pelanggan menemukan bahwa pintu toilet berisik saat dibuka and ditutup, mungkin engselnya perlu diperbaiki."
"1033104";"Wave 3 2024";"2090";"Service";"Tidak ada, sudah terangkum dalam kuesioner diatas."
"1033099";"Wave 3 2024";"Closed";"Service";"Secara keseluruhan, pelayanan toko sudah baik, and Retail Assistant juga memberikan pelayanan yang baik."
"1033154";"Wave 3 2024";"5085";"Service";"Pelanggan mengalami kesulitan dalam menemukan produk yang diinginkan karena jumlah stok and variasi ukurannya terbatas."
"1033167";"Wave 3 2024";"2228";"Service";"Store Eiger di Perintis Makassar sudah dalam kondisi yang cukup baik, with pelayanan yang informatif and ramah."
"1032598";"Wave 3 2024";"2054";"Service";"Store Eiger di Radio Dalam dalam kondisi yang sudah lumayan baik, rapi, and bersih. Namun, pelayanan kepada Pelanggan perlu ditingkatkan kembali karena Pelanggan merasa bingung dalam memilih barang yang hendak dibeli."
"1033001";"Wave 3 2024";"2355";"Service, People, Facility";"Pelayanan Retail Assistant masih kurang baik karena Retail Assistant terlihat sangat pasif, tidak ada menjelaskan mengenai produk secara detail kepada Pelanggan, pada saat Pelanggan melihat-lihat produk, Retail Assistant meninggalkan Pelanggan and menuju meja kasir padahal tidak ada Pelanggan lain. Standar grooming Retail Assistant juga masih kurang baik. Selain itu terdapat spanduk yang hampir lepas di depan Store."
"1033232";"Wave 3 2024";"2127";"Service";"Semua sudah tercakup dalam kuesioner."
"1033138";"Wave 3 2024";"5045";"Service";"Suasana Store yang ramai membuat Pelanggan tidak dilayani with maksimal oleh Retail Assistant, karena Retail Assistant hanya menghampiri jika dipanggil saja."
"1033137";"Wave 3 2024";"2056";"Service, People";"Store Eiger di Medan dalam kondisi baik. Namun, ketika Pelanggan tiba terdapat 1 kasir, 1 Retail Assistant, and 1 staf trainee di store. Karena keadaan store cukup ramai, Pelanggan kesulitan berinteraksi with Retail Assistant. Staf trainee menghampiri and menawarkan bantuan, tetapi setelah menunggu cukup lama, Pelanggan berpura-pura menelepon and keluar ke Indomaret sebelah. Ketika kembali, keadaan masih sama hingga beberapa menit kemudian 3/4 Retail Assistant selesai istirahat, and Pelanggan akhirnya bisa berinteraksi with Retail Assistant. Selain itu, saat transaksi, kasir terlihat mengunyah permen karet."
"1032943";"Wave 3 2024";"2052";"Service";"Retail Assistant menjelaskan terkait keunggulan dari produk tas with sangat baik tetapi untuk garansi dari produk tas tidak dijelaskan oleh Retail Assistant."
"1033256";"Wave 3 2024";"2109";"Service, People, Cleanliness";"Store Eiger di Jombang dalam kondisi baik, and pelayanannya juga memuaskan. Namun, salah satu Retail Assistant terlihat kurang aktif dalam melayani Pelanggan. Selain itu, toilet perlu dibersihkan lebih sering agar Pelanggan merasa nyaman saat menggunakannya."
"1033311";"Wave 3 2024";"2022";"Service, Cleanliness";"Store Eiger di Buaran, Jakarta, dalam kondisi baik, tetapi toilet terlihat kotor. Saat Pelanggan tiba, tidak ada Retail Assistant yang membukakan pintu, and di dalam store terdapat kurang dari 3 Pelanggan. Namun, store semakin ramai, and Retail Assistant tetap melayani with baik, cekatan, and kooperatif. Secara keseluruhan, Pelanggan merasa puas and nyaman."
"1033288";"Wave 3 2024";"2023";"Service";"Store Eiger di Pattimura dalam kondisi baik with pelayanan yang memuaskan. Retail Assistant menjelaskan informasi produk with detail kepada Pelanggan, and Kasirnya juga terlihat ramah."
"1033331";"Wave 3 2024";"2049";"People, Service";"Kasir terdengar mengobrol and tertawa bersama staf lain di depan Pelanggan di area kasir, termasuk saat proses transaksi berlangsung."
"1033332";"Wave 3 2024";"7028";"Service";"Secara keseluruhan pelayanan Retail Assistant cukup baik karena Retail Assistant ramah and selalu menanya produk yang mana yang diminati Pelanggan hanya saja saat itu Store sedang ramai, jadi Retail Assistant cukup sibuk melayani Pelanggan."
"1033348";"Wave 3 2024";"5017";"Service";"Store Eiger Grage Cirebon berada dalam kondisi yang baik, and pelayanannya juga sangat ramah serta memuaskan. Pelanggan merasa senang berbelanja di sini karena Retail Assistant selalu siap membantu and memberikan informasi yang diperlukan."
"1033380";"Wave 3 2024";"5064";"Service";"Store Eiger di TP II Surabaya dalam kondisi cukup baik and pelayanannya bagus, tetapi saat itu kondisi store ramai pengunjung, sehingga Retail Assistant terlihat kewalahan dalam melayani Pelanggan."
"1033212";"Wave 3 2024";"2219";"Service, Facility, Cleanliness";"Store Eiger di Surabaya Barat dalam kondisi yang perlu perhatian. Retail Assistant di lantai 2 and 3 tidak langsung siap menemui Pelanggan saat mereka datang. Selain itu, dinding-dinding di area tersebut tampak kotor, terutama di sepanjang tangga, yang menunjukkan bahwa kebersihan store perlu ditingkatkan."
"1033357";"Wave 3 2024";"2259";"Service";"Retail Assistant memiliki produk knowledge yang sangat bagus, sangat detail dalam menjelaskan produk, mulai dari keunggulan, kegunaan, cara perawatan, jenis and ukuran produk tas, sehingga Pelanggan with mudah menentukan produk yang sesuai untuk kebutuhan."
"1033885";"Wave 3 2024";"2207";"Cleanliness";"Disarankan agar kebersihan toilet toko lebih diperhatikan, and sebaiknya tidak ada alat atau barang yang tidak diperlukan, seperti sendok di dalamnya."
"1033350";"Wave 3 2024";"2345";"Service";"Store Eiger di Gorontalo sudah memberikan pelayanan yang cukup baik and informatif dari Store Leader and Retail Assistant. Namun, yang melayani di bagian tas saat di lantai 2 adalah trainee, karena di lantai 1 Retail Assistant sibuk with promosi siaran langsung."
"1033198";"Wave 3 2024";"2224";"Service";"Hal tersebut sudah tercantum dalam Kuesioner."
"1033533";"Wave 3 2024";"2043";"Service";"Hal tersebut sudah tercantum dalam Kuesioner."
"1033187";"Wave 3 2024";"7011";"Service, People";"Retail Assistant kurang memberikan sambutan kepada Pelanggan ketika Pelanggan baru tiba and beberapa kali Retail Assistant melakukan peneguran kepada Pelanggan dikarenakan Pelanggan melihat produk untuk wanita."
"1033610";"Wave 3 2024";"7014";"Cleanliness, Facility";"Disarankan untuk meningkatkan kenyamanan Pelanggan with menjaga kebersihan toilet secara lebih teratur. Meskipun pelayanan di toko ini sudah baik, perhatian yang lebih terhadap kebersihan toilet akan membuat Pelanggan merasa lebih nyaman and puas saat berkunjung."
"1033614";"Wave 3 2024";"2299";"Service";"Secara keseluruhan, pelayanan toko sudah baik, and Retail Assistant juga memberikan pelayanan yang baik."
"1033618";"Wave 3 2024";"2302";"Facility, Cleanliness";"Disarankan agar toko lebih memperhatikan kebersihan area parkir with memastikan bahwa area tersebut selalu bebas dari sampah, demi meningkatkan kenyamanan Pelanggan."
"1034697";"Wave 3 2024";"Closed";"Cleanliness, Facility, Service";"Disarankan agar toko lebih memperhatikan kebersihan toilet secara rutin and memastikan bahwa area fitting room, khususnya cat temboknya, tidak mengelupas agar tampak lebih terawat and nyaman bagi Pelanggan. Secara keseluruhan untuk pelayanan Retail Assistant sudah baik, pengetahuan terhadap produk and penjelasan detail produk juga bagus."
"1034326";"Wave 3 2024";"2116";"Service";"Saat Pelanggan melakukan kunjungan, kondisi store sedang ramai pengunjung. Sehingga menurut Pelanggan, pelayanan yang diberikan oleh Retail Assisant kurang maksimal karena perhatiannya yang terbagi-bagi. Mungkin kedepannya bisa ditambahkan Retail Assistant yang bertugas pada hari and jam yang biasanya ramai pengunjung, with harapan Pelanggan dapat menerima pelayanan yang optimal."
"1034103";"Wave 3 2024";"Closed";"Service, People";"Retail Assistant melayani with baik and ramah. Sedangkan Kasir terkesan cuek and hanya melayani pembayaran seadanya, tidak ada salam awal mauapun salam penutup."
"1033651";"Wave 3 2024";"2271";"Service";"Store Eiger di Tebet, Jakarta Selatan, sudah dalam kondisi baik, and pelayanan Retail Assistant juga memuaskan with memberikan penjelasan yang jelas mengenai informasi produk."
"1033676";"Wave 3 2024";"2191";"Service, Cleanliness";"Store Eiger di Cibubur dalam kondisi baik, and pelayanan Retail Assistant sudah memadai dalam memberikan informasi produk kepada Pelanggan. Namun, Kloset toilet perlu dibersihkan."
"1033679";"Wave 3 2024";"2045";"Facility, Cleanliness";"Store Eiger di Ambon terlihat kurang terawat dibagian dinding and langit-langit. Ruangan sebaiknya diberi pengharum agar lebih nyaman, karena tercium sedikit aroma kecoa dari area belakang sekitar toilet. Selain itu, terdapat beberapa barang berserakan di dekat tangga naik. Sebaiknya, jika Store masih dalam proses beres-beres, barang-barang tersebut tidak dibiarkan berantakan di area yang terlihat oleh Pelanggan. Stiker tanda arah pada tangga juga terlihat mengelupas and perlu segera diperbaiki. Sebagai tambahan, Pelanggan disambut oleh Retail Assistant with ucapan ""Silakan"" yang mana ini tidak sesuai SOP."
"1033675";"Wave 3 2024";"2011";"Service, Cleanliness";"Pelayanan Retail Assistant and Kasir sudah baik, ramah and informatif. Terdapat tempat sampah yang dibedakan menjadi tiga berdasarkan jenis sampahnya di depan Store."
"1033706";"Wave 3 2024";"2269";"Cleanliness, Facility";"Pelanggan menemukan bahwa toilet masih bergabung with gudang, dalam keadaan kotor, and penuh with barang. Selain itu, bak mandi diisi with alat-alat kebersihan."
"1033708";"Wave 3 2024";"2307";"Service";"Semua sudah tercakup dalam kuesioner."
"1033714";"Wave 3 2024";"2131";"Service";"Tidak ada, sudah tercantum semua."
"1033724";"Wave 3 2024";"2120";"Service";"Store Eiger di Narogong Bekasi dalam kondisi baik and pelayanannya sudah memuaskan. Namun, Retail Assistant diharapkan dapat lebih proaktif dalam menawarkan produk kepada Pelanggan."
"1033726";"Wave 3 2024";"2124";"Service, Facility";"Ketika barang with stok atau ukuran lain dibawakan dari gudang, Pelanggan menyadari bahwa barang tersebut tidak memiliki price tag. Oleh karena itu, ketika Pelanggan ditawari stok baru dari gudang, Pelanggan terpaksa memilih T-shirt yang ada di display karena lebih mudah memastikan harga with jelas. Satu Retail Assistant (laki-laki) lebih banyak berada di gudang and sesekali keluar, mungkin memang itu adalah tugasnya sebagai Retail Assistant yang bertanggung jawab di gudang. Mungkin Retail Assistant bisa diberikan pelatihan lebih lanjut terkait rincian ukuran baju, seperti panjang and LD (lingkar dada) untuk setiap ukuran, karena Pelanggan biasanya sudah memiliki patokan ukuran. Namun, akan lebih presisi jika ada penjelasan lebih detail mengenai LD sesuai jenis baju, apakah itu oversize, regular fit, atau slim fit. Sebagai tambahan, mungkin bisa dipertimbangkan untuk menyediakan air minum atau merchandise (seperti stiker, dll.) bagi Pelanggan yang sudah hampir pasti membeli sambil menunggu."
"1033736";"Wave 3 2024";"7032";"Service";"Secara keseluruhan pelayan Retail Assistant and Kasir sudah lumayan baik, tetapi saat pertama kali memasuki Store, Pelanggan tidak langsung dihampiri oleh Retail Assistant karena kondisi outlet sedang ramai, sehingga Pelanggan akhirnya mendekati Retail Assistant terlebih dahulu untuk menanyakan produk."
"1032610";"Wave 3 2024";"2344";"Cleanliness, Service, People";"Disarankan untuk lebih memperhatikan kebersihan toilet agar terhindar dari bau tidak sedap, serta pelayanannya lebih ditingkatkan agar kasir lebih ramah dalam melayani Pelanggan and mengenakan ID card sebagai identitas."
"1033796";"Wave 3 2024";"2019";"Service";"Store Eiger di Depok dalam kondisi cukup baik, with pelayanan Retail Assistant and Kasir yang juga memuaskan."
"1033863";"Wave 3 2024";"2130";"Service";"Tidak ada, sudah tercantum dalam kuesioner diatas."
"1033887";"Wave 3 2024";"2325";"Facility, Cleanliness";"Store Eiger di Thehok, Jambi, dalam kondisi baik. Namun, pencahayaan di toilet kurang terang and perlu diperbaiki agar Pelanggan lebih nyaman menggunakannya."
"1033886";"Wave 3 2024";"2212";"Service, Facility";"Retail Assistant kurang inisiatif dalam menjelaskan produk secara detail. Untuk banner promo yang terpajang di depan Store sudah kadaluarsa yaitu promo tanggal 19-31 Oktober, sedangkan Pelanggan melakukan kunjungan pada tanggal 2 November."
"1033193";"Wave 3 2024";"5000";"Cleanliness, Facility";"Secara keseluruhan, toko terlihat bersih and rapi, namun terdapat beberapa temuan di luar pertanyaan-pertanyaan di atas, yaitu: 1. Meja ambalan di fitting room 2 memiliki spot kotor yang berupa bekas selotip. 2. Meja ambalan di fitting room 2 miring, kemungkinan karena siku atau paku pada meja tersebut ada yang longgar atau lepas."
"1033893";"Wave 3 2024";"2321";"People, Service";"Store Eiger di Sipin Jambi, dalam kondisi baik with pelayanan Retail Assistant and kasir yang cukup membantu. Namun, terlihat bahwa Retail Assistant saling mengobrol with suara kencang di area kasir, yang dapat mengganggu kenyamanan Pelanggan."
"1033883";"Wave 3 2024";"2066";"Service";"Semua sudah tercakup dalam kuesioner."
"1033912";"Wave 3 2024";"Closed";"Cleanliness, Service";"Store Eiger di Diponegoro Surabaya, dalam kondisi baik with pelayanan Retail Assistant yang ramah. Namun, kebersihan toilet perlu diperhatikan lagi karena kurang nyaman digunakan oleh Pelanggan."
"1033917";"Wave 3 2024";"7031";"Service, Cleanliness";"Store Eiger di Surabaya Utara berada dalam kondisi yang baik, namun aspek pelayanan perlu ditingkatkan. Selain itu, toilet perlu dibersihkan lebih baik untuk memberikan kenyamanan bagi Pelanggan."
"1033215";"Wave 3 2024";"7039";"Service, People, Cleanliness, Facility";"Store EIGER di Samarinda Seberang dalam kondisi baik. terdapat Retail Assistant perempuan yang ramah and sopan dalam menjelaskan mengenai produk t-shirt. Namun, kasir terlihat sedikit cuek, and area jalan menuju toilet serta bagian belakang toko terlihat kurang rapi."
"1033920";"Wave 3 2024";"2036";"Facility, Service";"Sebaiknya segera memperbaiki flush and kran air di toilet agar tetap berfungsi with baik, demi menjaga kenyamanan Pelanggan. Selain itu untuk pelayanan Staf sudah lumayan baik, tetapi seharusnya walaupun keadaan Store sedang ramai Staf tetap harus melakukan salam penutup yang sesuai."
"1033922";"Wave 3 2024";"Closed";"Service, Facility";"ST EG OL MANYAR SURABAYA tidak memiliki Totem. Disarankan agar Retail Assistant lebih proaktif dalam menyapa and berinteraksi with pelanggan, serta memberikan informasi yang jelas tentang produk atau promo yang tersedia untuk menciptakan pengalaman belanja yang lebih baik. Selain itu lantai Store terlihat kurang terawat, karena lantai terlihat mengelupas atau retak."
"1033928";"Wave 3 2024";"2044";"Service";"Tidak ada, semua sudah tercantum di kuesioner."
"1033937";"Wave 3 2024";"2348";"Service";"Tidak ada, sudah tertera semua pada kuesioner diatas."
"1033944";"Wave 3 2024";"7037";"People, Service";"Tidak ada Retail Assistant di depan pintu masuk ketika Pelanggan memasuki toko, and Retail Assistant di lokasi kasir tampak tidak fokus serta tidak menyapa Pelanggan. Salah satu Retail Assistant bahkan terlihat duduk jongkok di depan pintu fitting room sambil bermain ponsel. Ketika Pelanggan mencari warna lain, Retail Assistant tidak dapat menunjukkan warna yang diminta, mengklaim bahwa warna tersebut tidak ada atau mungkin tercecer. Selain itu, saat Pelanggan pulang, tidak ada Retail Assistant yang standby di depan pintu, and produk-produk di lantai dua juga tidak ditawarkan kepada Pelanggan."
"1033933";"Wave 3 2024";"2065";"Service, Facility";"Pelanggan merasa telah menerima pelayanan yang cukup baik saat berbelanja di Store Eiger Outlet Ciputat, Jakarta. Namun, pelanggan menyarankan agar disediakan signage untuk memudahkan mengetahui lokasi toilet yang tersedia."
"1033925";"Wave 3 2024";"7041";"Service";"Store Eiger Marpoyan Pekanbaru, sudah dalam kondisi yang baik and pelayanan juga sangat baik."
